{
  "schema_version": "reviewer_task_request_v1",
  "request_id": "review_request_inflammatory_001",
  "action_id": "action_inflammatory_001",
  "plan_id": "plan_reviewer_fixture_001",
  "question_id": "question_reactive_mimic_001",
  "snapshot_id": "snapshot_001",
  "reviewer": "InflammatoryReactiveReviewer",
  "model_input": {
    "task_profile": "reactive_mimic_resolution",
    "target_features": [
      "reactive_regenerative_change",
      "adenomatous_architecture_absent",
      "dysplasia_not_evaluable_due_to_reactive_change"
    ],
    "primary_roi": {
      "roi_id": "roi_inflammatory_10x_001",
      "parent_roi_id": "roi_inflammatory_5x_001",
      "image_id": "image_inflammatory_10x_001",
      "image_ref": "artifact://reviewer-fixtures/roi_inflammatory_10x_001.png",
      "image_sha256": "6666666666666666666666666666666666666666666666666666666666666666",
      "level0_bbox": [10000, 10200, 11024, 11224],
      "magnification": 10,
      "pixel_dimensions": [1024, 1024],
      "mpp": 1.0
    },
    "context_views": [
      {
        "view_role": "parent_architecture",
        "roi": {
          "roi_id": "roi_inflammatory_5x_001",
          "image_id": "image_inflammatory_5x_001",
          "image_ref": "artifact://reviewer-fixtures/roi_inflammatory_5x_001.png",
          "image_sha256": "6767676767676767676767676767676767676767676767676767676767676767",
          "level0_bbox": [9488, 9688, 11536, 11736],
          "magnification": 5,
          "pixel_dimensions": [1024, 1024],
          "mpp": 2.0
        }
      }
    ]
  }
}
