{
  "schema_version": "reviewer_task_request_v1",
  "request_id": "review_request_serrated_001",
  "action_id": "action_serrated_001",
  "plan_id": "plan_reviewer_fixture_001",
  "question_id": "question_ssl_hp_001",
  "snapshot_id": "snapshot_001",
  "reviewer": "SerratedArchitectureReviewer",
  "model_input": {
    "task_profile": "ssl_hp_discrimination",
    "target_features": [
      "basal_crypt_dilation",
      "horizontal_or_boot_shaped_crypt",
      "surface_limited_serration"
    ],
    "primary_roi": {
      "roi_id": "roi_serrated_10x_001",
      "parent_roi_id": "roi_serrated_5x_001",
      "image_id": "image_serrated_10x_001",
      "image_ref": "artifact://reviewer-fixtures/roi_serrated_10x_001.png",
      "image_sha256": "2222222222222222222222222222222222222222222222222222222222222222",
      "level0_bbox": [2200, 2400, 3224, 3424],
      "magnification": 10,
      "pixel_dimensions": [1024, 1024],
      "mpp": 1.0
    },
    "context_views": [
      {
        "view_role": "parent_architecture",
        "roi": {
          "roi_id": "roi_serrated_5x_001",
          "image_id": "image_serrated_5x_001",
          "image_ref": "artifact://reviewer-fixtures/roi_serrated_5x_001.png",
          "image_sha256": "2323232323232323232323232323232323232323232323232323232323232323",
          "level0_bbox": [1688, 1888, 3736, 3936],
          "magnification": 5,
          "pixel_dimensions": [1024, 1024],
          "mpp": 2.0
        }
      }
    ]
  }
}
