{
  "schema_version": "reviewer_task_request_v1",
  "request_id": "review_request_conventional_001",
  "action_id": "action_conventional_001",
  "plan_id": "plan_reviewer_fixture_001",
  "question_id": "question_villous_extent_001",
  "snapshot_id": "snapshot_001",
  "reviewer": "ConventionalArchitectureReviewer",
  "model_input": {
    "task_profile": "villous_extent_estimation",
    "target_features": [
      "villous_component_present",
      "villous_component_extent_estimate",
      "tubular_villous_mixing"
    ],
    "primary_roi": {
      "roi_id": "roi_conventional_5x_001",
      "parent_roi_id": "roi_conventional_2p5x_001",
      "image_id": "image_conventional_5x_001",
      "image_ref": "artifact://reviewer-fixtures/roi_conventional_5x_001.png",
      "image_sha256": "4444444444444444444444444444444444444444444444444444444444444444",
      "level0_bbox": [6000, 6200, 8048, 8248],
      "magnification": 5,
      "pixel_dimensions": [1024, 1024],
      "mpp": 2.0
    },
    "context_views": [
      {
        "view_role": "parent_architecture",
        "roi": {
          "roi_id": "roi_conventional_2p5x_001",
          "image_id": "image_conventional_2p5x_001",
          "image_ref": "artifact://reviewer-fixtures/roi_conventional_2p5x_001.png",
          "image_sha256": "4545454545454545454545454545454545454545454545454545454545454545",
          "level0_bbox": [4976, 5176, 9072, 9272],
          "magnification": 2.5,
          "pixel_dimensions": [1024, 1024],
          "mpp": 4.0
        }
      }
    ]
  }
}
